{
  "cases": [
    {
      "action": "mask_required",
      "base_id": "name_male_prefix",
      "case_id": "C0001",
      "expected_spans": [
        {
          "end_cp": 34,
          "start_cp": 13,
          "type": "NAME"
        }
      ],
      "phenomena": [
        "plain",
        "space",
        "thai",
        "title"
      ],
      "provenance": "constructed-template:name_male_prefix",
      "scenario": "person",
      "text": "ผู้สมัครชื่อ นายกิตติทดสอบ ใจจำลอง"
    },
    {
      "action": "mask_required",
      "base_id": "name_male_prefix",
      "case_id": "C0002",
      "expected_spans": [
        {
          "end_cp": 48,
          "start_cp": 27,
          "type": "NAME"
        }
      ],
      "phenomena": [
        "punctuation",
        "space",
        "thai",
        "title"
      ],
      "provenance": "constructed-template:name_male_prefix",
      "scenario": "person",
      "text": "รายการทดสอบ: “ผู้สมัครชื่อ นายกิตติทดสอบ ใจจำลอง” (จบรายการ)"
    },
    {
      "action": "mask_required",
      "base_id": "name_female_prefix",
      "case_id": "C0003",
      "expected_spans": [
        {
          "end_cp": 52,
          "start_cp": 27,
          "type": "NAME"
        }
      ],
      "phenomena": [
        "punctuation",
        "space",
        "thai",
        "title"
      ],
      "provenance": "constructed-template:name_female_prefix",
      "scenario": "person",
      "text": "รายการทดสอบ: “ผู้ติดต่อคือ นางพิมพ์ทดสอบ ข้อมูลสมมติ” (จบรายการ)"
    },
    {
      "action": "mask_required",
      "base_id": "name_female_prefix",
      "case_id": "C0004",
      "expected_spans": [
        {
          "end_cp": 38,
          "start_cp": 13,
          "type": "NAME"
        }
      ],
      "phenomena": [
        "plain",
        "space",
        "thai",
        "title"
      ],
      "provenance": "constructed-template:name_female_prefix",
      "scenario": "person",
      "text": "ผู้ติดต่อคือ นางพิมพ์ทดสอบ ข้อมูลสมมติ"
    },
    {
      "action": "mask_required",
      "base_id": "name_miss_prefix",
      "case_id": "C0005",
      "expected_spans": [
        {
          "end_cp": 33,
          "start_cp": 9,
          "type": "NAME"
        }
      ],
      "phenomena": [
        "long-title",
        "plain",
        "thai"
      ],
      "provenance": "constructed-template:name_miss_prefix",
      "scenario": "person",
      "text": "นักเรียน นางสาวดาราทดสอบ แสงจำลอง มารายงานตัว"
    },
    {
      "action": "mask_required",
      "base_id": "name_miss_prefix",
      "case_id": "C0006",
      "expected_spans": [
        {
          "end_cp": 47,
          "start_cp": 23,
          "type": "NAME"
        }
      ],
      "phenomena": [
        "long-title",
        "punctuation",
        "thai"
      ],
      "provenance": "constructed-template:name_miss_prefix",
      "scenario": "person",
      "text": "รายการทดสอบ: “นักเรียน นางสาวดาราทดสอบ แสงจำลอง มารายงานตัว” (จบรายการ)"
    },
    {
      "action": "mask_required",
      "base_id": "name_label_no_prefix",
      "case_id": "C0007",
      "expected_spans": [
        {
          "end_cp": 44,
          "start_cp": 28,
          "type": "NAME"
        }
      ],
      "phenomena": [
        "explicit-label",
        "no-title",
        "punctuation",
        "thai"
      ],
      "provenance": "constructed-template:name_label_no_prefix",
      "scenario": "person",
      "text": "รายการทดสอบ: “ชื่อ-นามสกุล: ชลทดสอบ เมฆสมมติ” (จบรายการ)"
    },
    {
      "action": "mask_required",
      "base_id": "name_label_no_prefix",
      "case_id": "C0008",
      "expected_spans": [
        {
          "end_cp": 30,
          "start_cp": 14,
          "type": "NAME"
        }
      ],
      "phenomena": [
        "explicit-label",
        "no-title",
        "plain",
        "thai"
      ],
      "provenance": "constructed-template:name_label_no_prefix",
      "scenario": "person",
      "text": "ชื่อ-นามสกุล: ชลทดสอบ เมฆสมมติ"
    },
    {
      "action": "mask_required",
      "base_id": "name_glued",
      "case_id": "C0009",
      "expected_spans": [
        {
          "end_cp": 30,
          "start_cp": 13,
          "type": "NAME"
        }
      ],
      "phenomena": [
        "explicit-label",
        "no-space",
        "plain",
        "thai"
      ],
      "provenance": "constructed-template:name_glued",
      "scenario": "person",
      "text": "ชื่อผู้สมัคร:กิตติทดสอบใจจำลอง"
    },
    {
      "action": "mask_required",
      "base_id": "name_glued",
      "case_id": "C0010",
      "expected_spans": [
        {
          "end_cp": 44,
          "start_cp": 27,
          "type": "NAME"
        }
      ],
      "phenomena": [
        "explicit-label",
        "no-space",
        "punctuation",
        "thai"
      ],
      "provenance": "constructed-template:name_glued",
      "scenario": "person",
      "text": "รายการทดสอบ: “ชื่อผู้สมัคร:กิตติทดสอบใจจำลอง” (จบรายการ)"
    },
    {
      "action": "mask_required",
      "base_id": "name_repeated",
      "case_id": "C0011",
      "expected_spans": [
        {
          "end_cp": 35,
          "start_cp": 14,
          "type": "NAME"
        },
        {
          "end_cp": 60,
          "start_cp": 39,
          "type": "NAME"
        }
      ],
      "phenomena": [
        "punctuation",
        "repeated",
        "thai"
      ],
      "provenance": "constructed-template:name_repeated",
      "scenario": "person",
      "text": "รายการทดสอบ: “นายกิตติทดสอบ ใจจำลอง พบ นายกิตติทดสอบ ใจจำลอง” (จบรายการ)"
    },
    {
      "action": "mask_required",
      "base_id": "name_repeated",
      "case_id": "C0012",
      "expected_spans": [
        {
          "end_cp": 21,
          "start_cp": 0,
          "type": "NAME"
        },
        {
          "end_cp": 46,
          "start_cp": 25,
          "type": "NAME"
        }
      ],
      "phenomena": [
        "plain",
        "repeated",
        "thai"
      ],
      "provenance": "constructed-template:name_repeated",
      "scenario": "person",
      "text": "นายกิตติทดสอบ ใจจำลอง พบ นายกิตติทดสอบ ใจจำลอง"
    },
    {
      "action": "mask_required",
      "base_id": "phone_mobile_08",
      "case_id": "C0013",
      "expected_spans": [
        {
          "end_cp": 14,
          "start_cp": 4,
          "type": "PHONE"
        }
      ],
      "phenomena": [
        "contiguous",
        "mobile",
        "plain"
      ],
      "provenance": "constructed-template:phone_mobile_08",
      "scenario": "phone",
      "text": "โทร 0800000000"
    },
    {
      "action": "mask_required",
      "base_id": "phone_mobile_08",
      "case_id": "C0014",
      "expected_spans": [
        {
          "end_cp": 28,
          "start_cp": 18,
          "type": "PHONE"
        }
      ],
      "phenomena": [
        "contiguous",
        "mobile",
        "punctuation"
      ],
      "provenance": "constructed-template:phone_mobile_08",
      "scenario": "phone",
      "text": "รายการทดสอบ: “โทร 0800000000” (จบรายการ)"
    },
    {
      "action": "mask_required",
      "base_id": "phone_mobile_09",
      "case_id": "C0015",
      "expected_spans": [
        {
          "end_cp": 36,
          "start_cp": 26,
          "type": "PHONE"
        }
      ],
      "phenomena": [
        "contiguous",
        "mobile",
        "punctuation"
      ],
      "provenance": "constructed-template:phone_mobile_09",
      "scenario": "phone",
      "text": "รายการทดสอบ: “เบอร์ติดต่อ 0900000000” (จบรายการ)"
    },
    {
      "action": "mask_required",
      "base_id": "phone_mobile_09",
      "case_id": "C0016",
      "expected_spans": [
        {
          "end_cp": 22,
          "start_cp": 12,
          "type": "PHONE"
        }
      ],
      "phenomena": [
        "contiguous",
        "mobile",
        "plain"
      ],
      "provenance": "constructed-template:phone_mobile_09",
      "scenario": "phone",
      "text": "เบอร์ติดต่อ 0900000000"
    },
    {
      "action": "mask_required",
      "base_id": "phone_mobile_06",
      "case_id": "C0017",
      "expected_spans": [
        {
          "end_cp": 31,
          "start_cp": 21,
          "type": "PHONE"
        }
      ],
      "phenomena": [
        "contiguous",
        "mobile",
        "punctuation"
      ],
      "provenance": "constructed-template:phone_mobile_06",
      "scenario": "phone",
      "text": "รายการทดสอบ: “มือถือ 0600000000” (จบรายการ)"
    },
    {
      "action": "mask_required",
      "base_id": "phone_mobile_06",
      "case_id": "C0018",
      "expected_spans": [
        {
          "end_cp": 17,
          "start_cp": 7,
          "type": "PHONE"
        }
      ],
      "phenomena": [
        "contiguous",
        "mobile",
        "plain"
      ],
      "provenance": "constructed-template:phone_mobile_06",
      "scenario": "phone",
      "text": "มือถือ 0600000000"
    },
    {
      "action": "mask_required",
      "base_id": "phone_hyphen",
      "case_id": "C0019",
      "expected_spans": [
        {
          "end_cp": 21,
          "start_cp": 9,
          "type": "PHONE"
        }
      ],
      "phenomena": [
        "hyphen",
        "mobile",
        "plain"
      ],
      "provenance": "constructed-template:phone_hyphen",
      "scenario": "phone",
      "text": "โทรศัพท์ 089-000-0000"
    },
    {
      "action": "mask_required",
      "base_id": "phone_hyphen",
      "case_id": "C0020",
      "expected_spans": [
        {
          "end_cp": 35,
          "start_cp": 23,
          "type": "PHONE"
        }
      ],
      "phenomena": [
        "hyphen",
        "mobile",
        "punctuation"
      ],
      "provenance": "constructed-template:phone_hyphen",
      "scenario": "phone",
      "text": "รายการทดสอบ: “โทรศัพท์ 089-000-0000” (จบรายการ)"
    },
    {
      "action": "mask_required",
      "base_id": "phone_space",
      "case_id": "C0021",
      "expected_spans": [
        {
          "end_cp": 33,
          "start_cp": 21,